{
  "$schema": "http://json-schema.org/draft-07/schema#",
  "title": "CatalogItem",
  "type": "object",
  "required": [
    "manufacturer",
    "item_number",
    "scale",
    "category",
    "description",
    "power_method",
    "epoch",
    "count"
  ],
  "properties": {
    "manufacturer": {
      "type": "string",
      "minLength": 3,
      "maxLength": 50
    },
    "item_number": {
      "type": "string",
      "minLength": 1,
      "maxLength": 25
    },
    "scale": {
      "type": "string",
      "minLength": 1,
      "maxLength": 50
    },
    "category": {
      "type": "string",
      "enum": [
        "ELECTRIC_MULTIPLE_UNITS",
        "FREIGHT_CARS",
        "LOCOMOTIVES",
        "PASSENGER_CARS",
        "RAILCARS",
        "STARTER_SETS",
        "TRAIN_SETS"
      ]
    },
    "description": {
      "type": "object",
      "additionalProperties": {
        "type": [ "string", "null" ]
      }
    },
    "details": {
      "type": "object",
      "additionalProperties": {
        "type": [ "string", "null" ]
      }
    },
    "power_method": {
      "type": "string",
      "enum": [
        "AC",
        "DC",
        "TRIX_EXPRESS"
      ]
    },
    "epoch": {
      "type": "string",
      "minLength": 1,
      "maxLength": 10
    },
    "delivery_date": {
      "type": [
        "string",
        "null"
      ],
      "minLength": 4,
      "maxLength": 7
    },
    "availability_status": {
      "type": "string",
      "enum": [
        "ANNOUNCED",
        "AVAILABLE",
        "DISCONTINUED"
      ]
    },
    "rolling_stocks": {
      "type": "array",
      "items": {
        "$ref": "#/definitions/RollingStock"
      }
    },
    "count": {
      "type": "integer",
      "format": "uint8",
      "minimum": 1,
      "maximum": 99
    }
  },
  "definitions": {
    "Coupling": {
      "type": "object",
      "properties": {
        "socket": {
          "type": ["string", "null"],
          "enum": [
            null,
            "NONE",
            "NEM_355",
            "NEM_356",
            "NEM_357",
            "NEM_359",
            "NEM_360",
            "NEM_362",
            "NEM_365"
          ]
        },
        "close_couplers": {
          "$ref": "#/definitions/FeatureFlag"
        },
        "digital_shunting": {
          "$ref": "#/definitions/FeatureFlag"
        }
      }
    },
    "ElectricMultipleUnitType": {
      "type": "string",
      "enum": [
        "DRIVING_CAR",
        "HIGH_SPEED_TRAIN",
        "MOTOR_CAR",
        "POWER_CAR",
        "TRAILER_CAR",
        "TRAIN_SET"
      ]
    },
    "FreightCarType": {
      "type": ["string", "null"],
      "enum": [
        null,
        "AUTO_TRANSPORT_CARS",
        "BRAKE_WAGON",
        "CONTAINER_CARS",
        "COVERED_FREIGHT_CARS",
        "DEEP_WELL_FLAT_CARS",
        "DUMP_CARS",
        "GONDOLA",
        "HEAVY_GOODS_WAGONS",
        "HINGED_COVER_WAGONS",
        "HOPPER_WAGON",
        "REFRIGERATOR_CARS",
        "SILO_CONTAINER_CARS",
        "SLIDE_TARPAULIN_WAGON",
        "SLIDING_WALL_BOXCARS",
        "SPECIAL_TRANSPORT",
        "STAKE_WAGONS",
        "SWING_ROOF_WAGON",
        "TANK_CARS",
        "TELESCOPE_HOOD_WAGONS"
      ]
    },
    "LocomotiveType": {
      "type": "string",
      "enum": [
        "DIESEL_LOCOMOTIVE",
        "ELECTRIC_LOCOMOTIVE",
        "STEAM_LOCOMOTIVE"
      ]
    },
    "PassengerCarType": {
      "type": ["string", "null"],
      "enum": [
        null,
        "BAGGAGE_CAR",
        "COMBINE_CAR",
        "COMPARTMENT_COACH",
        "DINING_CAR",
        "DOUBLE_DECKER",
        "DRIVING_TRAILER",
        "LOUNGE",
        "OBSERVATION",
        "OPEN_COACH",
        "RAILWAY_POST_OFFICE",
        "SLEEPING_CAR"
      ]
    },
    "FeatureFlag": {
      "type": "string",
      "enum": [
        "YES",
        "NO",
        "NOT_APPLICABLE"
      ]
    },
    "RailcarType": {
      "type": "string",
      "enum": [
        "null",
        "POWER_CAR",
        "TRAILER_CAR"
      ]
    },
    "RollingStock": {
      "type": "object",
      "required": [
        "category",
        "railway",
        "technical_specifications"
      ],
      "properties": {
        "category": {
          "type": "string",
          "enum": [
            "ELECTRIC_MULTIPLE_UNITS",
            "FREIGHT_CARS",
            "LOCOMOTIVES",
            "PASSENGER_CARS",
            "RAILCARS"
          ]
        },
        "control": {
          "type": ["string", "null"],
          "enum": [
            null,
            "DCC",
            "DCC_READY",
            "DCC_SOUND",
            "NO_DCC"
          ]
        },
        "dcc_interface": {
          "type": ["string", "null"],
          "enum": [
            null,
            "MTC_21",
            "NEM_651",
            "NEM_652",
            "NEM_654",
            "NEXT_18",
            "NEXT_18_S",
            "PLUX_12",
            "PLUX_16",
            "PLUX_22",
            "PLUX_8"
          ]
        },
        "depot": {
          "type": [
            "string",
            "null"
          ],
          "maxLength": 100
        },
        "is_dummy": {
          "type": [
            "boolean",
            "null"
          ]
        },
        "livery": {
          "type": [
            "string",
            "null"
          ],
          "maxLength": 50
        },
        "railway": {
          "type": "string"
        },
        "type_name": {
          "type": "string",
          "minLength": 3,
          "maxLength": 25
        },
        "road_number": {
          "type": [
            "string",
            "null"
          ],
          "maxLength": 25
        },
        "series": {
          "type": [
            "string",
            "null"
          ],
          "maxLength": 100
        },
        "service_level": {
          "type": ["string", "null"],
          "enum": [
            null,
            "FIRST_CLASS",
            "SECOND_CLASS",
            "THIRD_CLASS",
            "FIRST_AND_SECOND_CLASS",
            "FIRST_SECOND_AND_THIRD_CLASS",
            "SECOND_AND_THIRD_CLASS"
          ]
        },
        "sub_category": {
          "type": [
            "string",
            "null"
          ]
        },
        "technical_specifications": {
          "$ref": "#/definitions/TechnicalSpecifications"
        }
      }
    },
    "TechnicalSpecifications": {
      "type": "object",
      "required": [
        "body_shell",
        "chassis",
        "coupling",
        "flywheel_fitted",
        "interior_lights",
        "lights",
        "minimum_radius",
        "sprung_buffers"
      ],
      "properties": {
        "body_shell": {
          "type": ["string", "null"],
          "enum": [
            null,
            "METAL_DIE_CAST",
            "PLASTIC"
          ]
        },
        "chassis": {
          "type": ["string", "null"],
          "enum": [
            null,
            "METAL_DIE_CAST",
            "PLASTIC"
          ]
        },
        "coupling": {
          "$ref": "#/definitions/Coupling"
        },
        "flywheel_fitted": {
          "$ref": "#/definitions/FeatureFlag"
        },
        "interior_lights": {
          "$ref": "#/definitions/FeatureFlag"
        },
        "lights": {
          "$ref": "#/definitions/FeatureFlag"
        },
        "minimum_radius": {
          "type": ["number", "null"],
          "minimum": 0.1
        },
        "sprung_buffers": {
          "$ref": "#/definitions/FeatureFlag"
        }
      }
    }
  }
}
