{
  "manufacturer": "Piko",
  "item_number": "97471",
  "scale": "H0",
  "category": "LOCOMOTIVES",
  "power_method": "DC",
  "epoch": "III",
  "description": {
    "de": null,
    "fr": null,
    "en": null,
    "it": "Locomotiva elettrica E.428 FS di prima serie con prese d'aria basse"
  },
  "details": {
    "de": null,
    "fr": null,
    "en": null,
    "it": null
  },
  "delivery_date": "2024",
  "availability_status": "ANNOUNCED",
  "rolling_stocks": [
    {
      "category": "LOCOMOTIVES",
      "locomotive_type": "ELECTRIC_LOCOMOTIVE",
      "railway": "FS",
      "class_name": "E428",
      "road_number": "E428 ???",
      "series": "prima serie con avancorpi",
      "livery": "castano/Isabella",
      "length_over_buffers": {
        "inches": null,
        "millimeters": 218.0
      },
      "technical_specifications": {
        "minimum_radius": 358.0,
        "coupling": {
          "socket": "NEM_362",
          "close_couplers": "NO",
          "digital_shunting": "NO"
        },
        "flywheel_fitted": "NO",
        "body_shell": "PLASTIC",
        "chassis": "METAL_DIE_CAST",
        "interior_lights": "NO",
        "lights": "YES",
        "sprung_buffers": "NO"
      },
      "control": "DCC_SOUND",
      "dcc_interface": "PLUX_22",
      "is_dummy": false
    }
  ],
  "count": 1
}