{
  "manufacturer": "Rivarossi/Hornby",
  "item_number": "HR2176",
  "scale": "H0",
  "category": "LOCOMOTIVES",
  "power_method": "DC",
  "epoch": "III",
  "description": {
    "de": null,
    "fr": null,
    "en": null,
    "it": "Locomotiva elettrica E428 102 con compressore meccanico, separatore D'Arbela, DCC Sound"
  },
  "details": {
    "de": null,
    "fr": null,
    "en": null,
    "it": null
  },
  "delivery_date": "2011",
  "availability_status": "AVAILABLE",
  "rolling_stocks": [
    {
      "category": "LOCOMOTIVES",
      "locomotive_type": "ELECTRIC_LOCOMOTIVE",
      "railway": "FS",
      "class_name": "E428",
      "road_number": "E428 102",
      "series": "seconda serie con avancorpi",
      "livery": "castano/isabella",
      "technical_specifications": {
        "minimum_radius": 360.0,
        "coupling": {
          "socket": null,
          "close_couplers": "YES",
          "digital_shunting": "NO"
        },
        "flywheel_fitted": "NO",
        "body_shell": null,
        "chassis": null,
        "interior_lights": "NO",
        "lights": "YES",
        "sprung_buffers": "YES"
      },
      "control": "DCC_SOUND",
      "dcc_interface": "NEM_652",
      "is_dummy": false
    }
  ],
  "count": 1
}