{
  "manufacturer": "Rivarossi/Hornby",
  "item_number": "HR4367",
  "scale": "H0",
  "category": "PASSENGER_CARS",
  "power_method": "DC",
  "epoch": "III",
  "description": {
    "de": null,
    "fr": null,
    "en": "FS, 2-unit pack of coaches, Castano/Isabella livery, including 1 x 2nd class coach Bz 33010 Type 1946 with “ristoro” compartment and 1 x 2nd class coach Bz 33010, ep. II",
    "it": "FS, set di 2 carrozze Tipo 1946, composto da 2 carrozze di 2a classe Bz 33010, una con comparto ristoro, livrea castano/Isabella, ep. III"
  },
  "details": {
    "de": null,
    "fr": null,
    "en": null,
    "it": null
  },
  "delivery_date": "2024",
  "availability_status": "ANNOUNCED",
  "rolling_stocks": [
    {
      "category": "PASSENGER_CARS",
      "railway": "FS",
      "type_name": "Tipo 46",
      "livery": "castano/Isabella",
      "service_level": "SECOND_CLASS",
      "length_over_buffers": {
        "inches": null,
        "millimeters": 262.0
      },
      "technical_specifications": {
        "minimum_radius": 360.0,
        "coupling": {
          "socket": "NEM_362",
          "close_couplers": "YES",
          "digital_shunting": "NO"
        },
        "flywheel_fitted": "NOT_APPLICABLE",
        "body_shell": null,
        "chassis": null,
        "interior_lights": "NO",
        "lights": "NO",
        "sprung_buffers": "YES"
      },
      "is_dummy": null
    },
    {
      "category": "PASSENGER_CARS",
      "railway": "FS",
      "type_name": "Tipo 46",
      "livery": "castano/Isabella",
      "service_level": "SECOND_CLASS",
      "length_over_buffers": {
        "inches": null,
        "millimeters": 262.0
      },
      "technical_specifications": {
        "minimum_radius": 360.0,
        "coupling": {
          "socket": "NEM_362",
          "close_couplers": "YES",
          "digital_shunting": "NO"
        },
        "flywheel_fitted": "NOT_APPLICABLE",
        "body_shell": null,
        "chassis": null,
        "interior_lights": "NO",
        "lights": "NO",
        "sprung_buffers": "YES"
      },
      "is_dummy": null
    }
  ],
  "count": 2
}