{
  "manufacturer": "Lima",
  "item_number": "208227",
  "scale": "H0",
  "category": "LOCOMOTIVES",
  "power_method": "DC",
  "epoch": "III",
  "description": {
    "de": null,
    "fr": null,
    "en": null,
    "it": "Castano/isabella/rosso, 2 fanali, corrimani sul tetto, dep. Siena, cardano singolo"
  },
  "details": {
    "de": null,
    "fr": null,
    "en": null,
    "it": null
  },
  "delivery_date": "1990",
  "availability_status": "AVAILABLE",
  "rolling_stocks": [
    {
      "category": "LOCOMOTIVES",
      "locomotive_type": "DIESEL_LOCOMOTIVE",
      "railway": "FS",
      "class_name": "D342",
      "road_number": "D342 4003",
      "series": "ANSALDO",
      "livery": "",
      "technical_specifications": {
        "minimum_radius": 360.0,
        "coupling": {
          "socket": null,
          "close_couplers": "NO",
          "digital_shunting": "NO"
        },
        "flywheel_fitted": "NO",
        "body_shell": null,
        "chassis": null,
        "interior_lights": "NO",
        "lights": "YES",
        "sprung_buffers": "NO"
      },
      "control": "DCC_READY",
      "is_dummy": false
    }
  ],
  "count": 1
}