{
  "manufacturer": "ACME",
  "item_number": "60132",
  "scale": "H0",
  "category": "LOCOMOTIVES",
  "power_method": "DC",
  "epoch": "IV",
  "description": {
    "de": null,
    "fr": null,
    "en": null,
    "it": "Locomotiva elettrica FS E646 189 nella livrea verde/grigio navetta senza modanature, finestrini, portelloni alti, fregio rosso, dep. Roma S. L."
  },
  "details": {
    "de": null,
    "fr": null,
    "en": null,
    "it": null
  },
  "delivery_date": "2009",
  "availability_status": "AVAILABLE",
  "rolling_stocks": [
    {
      "category": "LOCOMOTIVES",
      "locomotive_type": "ELECTRIC_LOCOMOTIVE",
      "railway": "FS",
      "class_name": "E646",
      "road_number": "E646 189",
      "series": "SECONDA SERIE",
      "depot": "Roma San Lorenzo",
      "livery": "verde/grigio",
      "technical_specifications": {
        "minimum_radius": 360.0,
        "coupling": {
          "socket": "NEM_362",
          "close_couplers": "YES",
          "digital_shunting": "NO"
        },
        "flywheel_fitted": "NO",
        "body_shell": null,
        "chassis": null,
        "interior_lights": "NO",
        "lights": "YES",
        "sprung_buffers": "NO"
      },
      "control": "DCC_READY",
      "dcc_interface": "NEM_652",
      "is_dummy": false
    }
  ],
  "count": 1
}