{
  "manufacturer": "Roco",
  "item_number": "72893",
  "scale": "H0",
  "category": "LOCOMOTIVES",
  "power_method": "DC",
  "epoch": "IVa",
  "description": {
    "de": null,
    "fr": null,
    "en": null,
    "it": "Serie 2000 Breda, vetri curvi, modanature, griglia squadrata, 2 scarichi centrali, dep. Lecco"
  },
  "details": {
    "de": null,
    "fr": null,
    "en": null,
    "it": null
  },
  "delivery_date": null,
  "availability_status": "AVAILABLE",
  "rolling_stocks": [
    {
      "category": "LOCOMOTIVES",
      "locomotive_type": "DIESEL_LOCOMOTIVE",
      "railway": "FS",
      "class_name": "D343",
      "road_number": "D343 2001",
      "livery": "",
      "technical_specifications": {
        "minimum_radius": 360.0,
        "coupling": {
          "socket": null,
          "close_couplers": "NO",
          "digital_shunting": "NO"
        },
        "flywheel_fitted": "NO",
        "body_shell": null,
        "chassis": null,
        "interior_lights": "NO",
        "lights": "YES",
        "sprung_buffers": "NO"
      },
      "control": "DCC_READY",
      "is_dummy": false
    }
  ],
  "count": 1
}