{
  "manufacturer": "ACME",
  "item_number": "60595",
  "scale": "H0",
  "category": "LOCOMOTIVES",
  "power_method": "DC",
  "epoch": "V",
  "description": {
    "de": null,
    "fr": null,
    "en": null,
    "it": "Locomotiva E646 081 navetta in livrea MDVC, deposito di Milano Smistamento, con vetri frontali corazzati, sfogatoi sul tetto di tipo piccolo, senza smorzatori. Nello stato del 1988"
  },
  "details": {
    "de": null,
    "fr": null,
    "en": null,
    "it": ""
  },
  "delivery_date": "2023/Q1",
  "availability_status": "AVAILABLE",
  "rolling_stocks": [
    {
      "category": "LOCOMOTIVES",
      "locomotive_type": "ELECTRIC_LOCOMOTIVE",
      "railway": "FS",
      "class_name": "E646",
      "road_number": "E646 081",
      "series": "SECONDA SERIE NAVETTA",
      "depot": "Milano Smistamento",
      "livery": "MDVC",
      "length_over_buffers": {
        "inches": 8.267721,
        "millimeters": 210.0
      },
      "technical_specifications": {
        "minimum_radius": 360.0,
        "coupling": {
          "socket": "NEM_362",
          "close_couplers": "YES",
          "digital_shunting": "NO"
        },
        "flywheel_fitted": "NO",
        "body_shell": null,
        "chassis": null,
        "interior_lights": "NO",
        "lights": "YES",
        "sprung_buffers": "YES"
      },
      "control": "DCC_READY",
      "dcc_interface": "MTC_21",
      "is_dummy": false
    }
  ],
  "count": 1
}