{
  "manufacturer": "ACME",
  "item_number": "60499",
  "scale": "H0",
  "category": "LOCOMOTIVES",
  "power_method": "DC",
  "epoch": "VI",
  "description": {
    "de": null,
    "fr": null,
    "en": null,
    "it": "Locomotiva elettrica E652 052 nella livrea XMPR2, logo FS Mercitalia Rail, vomere rosso, condotte alte"
  },
  "details": {
    "de": null,
    "fr": null,
    "en": null,
    "it": null
  },
  "delivery_date": "2020",
  "availability_status": "AVAILABLE",
  "rolling_stocks": [
    {
      "category": "LOCOMOTIVES",
      "locomotive_type": "ELECTRIC_LOCOMOTIVE",
      "railway": "FS",
      "class_name": "E652",
      "road_number": "E652 052",
      "livery": "XMPR2",
      "technical_specifications": {
        "minimum_radius": 360.0,
        "coupling": {
          "socket": "NEM_362",
          "close_couplers": "YES",
          "digital_shunting": "NO"
        },
        "flywheel_fitted": "NO",
        "body_shell": null,
        "chassis": null,
        "interior_lights": "NO",
        "lights": "YES",
        "sprung_buffers": "NO"
      },
      "control": "DCC_READY",
      "dcc_interface": "MTC_21",
      "is_dummy": false
    }
  ],
  "count": 1
}