{
  "manufacturer": "ACME",
  "item_number": "60458",
  "scale": "H0",
  "category": "LOCOMOTIVES",
  "power_method": "DC",
  "epoch": "Vb/VI",
  "description": {
    "de": null,
    "fr": null,
    "en": null,
    "it": "Locomotiva elettrica FS E636 117 nella livrea storica blu/grigio, vomere giallo, logo Trenitalia, pantografi 52 strisciante piano"
  },
  "details": {
    "de": null,
    "fr": null,
    "en": null,
    "it": null
  },
  "delivery_date": "2018",
  "availability_status": "AVAILABLE",
  "rolling_stocks": [
    {
      "category": "LOCOMOTIVES",
      "locomotive_type": "ELECTRIC_LOCOMOTIVE",
      "railway": "FS",
      "class_name": "E636",
      "road_number": "E636 117",
      "series": "SECONDA SERIE",
      "depot": "Roma San Lorenzo",
      "livery": "blu/grigio",
      "technical_specifications": {
        "minimum_radius": 360.0,
        "coupling": {
          "socket": "NEM_362",
          "close_couplers": "YES",
          "digital_shunting": "NO"
        },
        "flywheel_fitted": "NO",
        "body_shell": null,
        "chassis": null,
        "interior_lights": "NO",
        "lights": "YES",
        "sprung_buffers": "NO"
      },
      "control": "DCC_READY",
      "dcc_interface": "MTC_21",
      "is_dummy": false
    }
  ],
  "count": 1
}