{
  "manufacturer": "Rivarossi/Hornby",
  "item_number": "HR4365",
  "scale": "H0",
  "category": "PASSENGER_CARS",
  "power_method": "DC",
  "epoch": "III",
  "description": {
    "de": null,
    "fr": null,
    "en": "FS, 3-unit pack of coaches, castano livery, including 1 x luggage van Dz 83000, 1 x 1st class coach Az 13010 Type 1946 and 1 x 2nd class coach Bz33010 Type 1946, ep. III",
    "it": "FS, set di 3 carrozze Tipo 1946, composto da 1 bagagliaio Dz 83000, 1 carrozza di 1a classe Az 13010 e 1 carrozza di 2a classe Bz 33010, livrea castano, ep. III"
  },
  "details": {
    "de": null,
    "fr": null,
    "en": null,
    "it": null
  },
  "delivery_date": "2024",
  "availability_status": "ANNOUNCED",
  "rolling_stocks": [
    {
      "category": "PASSENGER_CARS",
      "railway": "FS",
      "type_name": "bagagliaio Dz 83000",
      "livery": "castano",
      "length_over_buffers": {
        "inches": null,
        "millimeters": 262.0
      },
      "technical_specifications": {
        "minimum_radius": 360.0,
        "coupling": {
          "socket": "NEM_362",
          "close_couplers": "YES",
          "digital_shunting": "NO"
        },
        "flywheel_fitted": "NOT_APPLICABLE",
        "body_shell": null,
        "chassis": null,
        "interior_lights": "NO",
        "lights": "NO",
        "sprung_buffers": "YES"
      },
      "is_dummy": null
    },
    {
      "category": "PASSENGER_CARS",
      "railway": "FS",
      "type_name": "Tipo 1946",
      "road_number": "Az 13010",
      "livery": "castano",
      "service_level": "FIRST_CLASS",
      "length_over_buffers": {
        "inches": null,
        "millimeters": 262.0
      },
      "technical_specifications": {
        "minimum_radius": 360.0,
        "coupling": {
          "socket": "NEM_362",
          "close_couplers": "YES",
          "digital_shunting": "NO"
        },
        "flywheel_fitted": "NOT_APPLICABLE",
        "body_shell": null,
        "chassis": null,
        "interior_lights": "NO",
        "lights": "NO",
        "sprung_buffers": "YES"
      },
      "is_dummy": null
    },
    {
      "category": "PASSENGER_CARS",
      "railway": "FS",
      "type_name": "Tipo 1946",
      "road_number": "Bz 33010",
      "livery": "castano",
      "service_level": "SECOND_CLASS",
      "length_over_buffers": {
        "inches": null,
        "millimeters": 262.0
      },
      "technical_specifications": {
        "minimum_radius": 360.0,
        "coupling": {
          "socket": "NEM_362",
          "close_couplers": "YES",
          "digital_shunting": "NO"
        },
        "flywheel_fitted": "NOT_APPLICABLE",
        "body_shell": null,
        "chassis": null,
        "interior_lights": "NO",
        "lights": "NO",
        "sprung_buffers": "YES"
      },
      "is_dummy": null
    }
  ],
  "count": 3
}