{
  "manufacturer": "Rivarossi",
  "item_number": "R1438",
  "scale": "H0",
  "category": "LOCOMOTIVES",
  "power_method": "DC",
  "epoch": "V",
  "description": {
    "de": null,
    "fr": null,
    "en": null,
    "it": "Livrea d'origine, 'Francia' 2 pantografi monobraccio SNCF + 1 ATR90 FS, OML Milano Sm."
  },
  "details": {
    "de": null,
    "fr": null,
    "en": null,
    "it": null
  },
  "delivery_date": "2003",
  "availability_status": "AVAILABLE",
  "rolling_stocks": [
    {
      "category": "LOCOMOTIVES",
      "locomotive_type": "ELECTRIC_LOCOMOTIVE",
      "railway": "FS",
      "class_name": "E402 B",
      "road_number": "E402 157",
      "livery": "",
      "technical_specifications": {
        "minimum_radius": 360.0,
        "coupling": {
          "socket": null,
          "close_couplers": "NO",
          "digital_shunting": "NO"
        },
        "flywheel_fitted": "NO",
        "body_shell": null,
        "chassis": null,
        "interior_lights": "NO",
        "lights": "YES",
        "sprung_buffers": "NO"
      },
      "control": "DCC_READY",
      "is_dummy": false
    }
  ],
  "count": 1
}