{
  "manufacturer": "Os.Kar",
  "item_number": "1687",
  "scale": "H0",
  "category": "LOCOMOTIVES",
  "power_method": "DC",
  "epoch": "III",
  "description": {
    "de": null,
    "fr": null,
    "en": null,
    "it": "Fanali a petrolio, tender a carrelli 22 mc con scalette standard"
  },
  "details": {
    "de": null,
    "fr": null,
    "en": null,
    "it": null
  },
  "delivery_date": "2018",
  "availability_status": "AVAILABLE",
  "rolling_stocks": [
    {
      "category": "LOCOMOTIVES",
      "locomotive_type": "STEAM_LOCOMOTIVE",
      "railway": "FS",
      "class_name": "685",
      "road_number": "685 443",
      "series": "SERIE 300 (ex Gr. 680)",
      "livery": "",
      "technical_specifications": {
        "minimum_radius": 360.0,
        "coupling": {
          "socket": null,
          "close_couplers": "NO",
          "digital_shunting": "NO"
        },
        "flywheel_fitted": "NO",
        "body_shell": null,
        "chassis": null,
        "interior_lights": "NO",
        "lights": "YES",
        "sprung_buffers": "NO"
      },
      "control": "DCC_READY",
      "is_dummy": false
    }
  ],
  "count": 1
}