{
  "manufacturer": "ACME",
  "item_number": "60151",
  "scale": "H0",
  "category": "LOCOMOTIVES",
  "power_method": "DC",
  "epoch": "IIIb",
  "description": {
    "de": null,
    "fr": null,
    "en": null,
    "it": "Locomotiva elettrica FS E.646 015 (1a serie) nella livrea verde e grigio di origine, fregio alato, pantografi 42 strisciante curvo, scalette piccole, dep. Napoli"
  },
  "details": {
    "de": null,
    "fr": null,
    "en": null,
    "it": null
  },
  "delivery_date": "2012",
  "availability_status": "AVAILABLE",
  "rolling_stocks": [
    {
      "category": "LOCOMOTIVES",
      "locomotive_type": "ELECTRIC_LOCOMOTIVE",
      "railway": "FS",
      "class_name": "E646",
      "road_number": "E646 015",
      "series": "PRIMA SERIE",
      "depot": "Napoli Smistamento",
      "livery": "verde/grigio",
      "technical_specifications": {
        "minimum_radius": 360.0,
        "coupling": {
          "socket": "NEM_362",
          "close_couplers": "YES",
          "digital_shunting": "NO"
        },
        "flywheel_fitted": "NO",
        "body_shell": null,
        "chassis": null,
        "interior_lights": "NO",
        "lights": "YES",
        "sprung_buffers": "NO"
      },
      "control": "DCC_READY",
      "dcc_interface": "NEM_652",
      "is_dummy": false
    }
  ],
  "count": 1
}